{
  "schemaVersion": "1.0",
  "id": "gaziantep",
  "name": {
    "en": "Gaziantep",
    "tr": "Gaziantep"
  },
  "regionId": "southeastern-anatolia",
  "guideId": "nasreddin-hoca",
  "estimatedMinutes": 5,
  "coordinates": {
    "longitude": 37.38,
    "latitude": 37.07
  },
  "environment": {
    "kitId": "southeastern-yellow-stone-bazaar",
    "timeOfDay": "warm-afternoon",
    "ambientAudioId": "amb_gaziantep_bazaar",
    "skyPreset": "warm-clear",
    "qualityNotes": [
      "Background shoppers use low-cost animation or cards",
      "Copper reflections must remain lightweight"
    ]
  },
  "spawn": {
    "position": [
      0,
      0,
      7
    ],
    "rotation": [
      0,
      3.14159,
      0
    ],
    "scale": [
      1,
      1,
      1
    ]
  },
  "route": {
    "mode": "curated-path",
    "points": [
      [
        0,
        0,
        7
      ],
      [
        1,
        0,
        0
      ],
      [
        8,
        0,
        -5
      ],
      [
        16,
        0,
        -6
      ],
      [
        24,
        0,
        -2
      ]
    ],
    "bounds": [
      [
        -5,
        0,
        12
      ],
      [
        29,
        0,
        12
      ],
      [
        29,
        0,
        -14
      ],
      [
        -5,
        0,
        -14
      ]
    ]
  },
  "intro": {
    "title": {
      "en": "Mosaics, Pistachios and Copper",
      "tr": "Mozaik, Fıstık ve Bakır"
    },
    "guideLine": {
      "en": "Listen carefully. This bazaar has its own rhythm.",
      "tr": "Dikkatle dinle. Bu çarşının kendine özgü bir ritmi var."
    },
    "cameraSequenceId": "intro_gaziantep_bazaar",
    "skippable": true
  },
  "hotspots": [
    {
      "id": "gaziantep-zeugma",
      "order": 1,
      "assetId": "city_gaziantep_zeugma_mosaic_panel",
      "transform": {
        "position": [
          4,
          1.3,
          -1
        ],
        "rotation": [
          0,
          -0.9,
          0
        ],
        "scale": [
          1.4,
          1.4,
          1.4
        ]
      },
      "triggerRadius": 3,
      "camera": {
        "position": [
          1,
          2.2,
          3
        ],
        "target": [
          4,
          1.4,
          -1
        ],
        "durationMs": 850
      },
      "interaction": {
        "type": "inspect-and-find",
        "config": {
          "targetId": "eye-highlight",
          "instruction": {
            "en": "Find the tiny light-colored tile that makes the eye shine.",
            "tr": "Gözü parlak gösteren küçük açık renkli taşı bul."
          },
          "hintAfterAttempts": 2
        }
      },
      "fact": {
        "title": {
          "en": "Zeugma Mosaics",
          "tr": "Zeugma Mozaikleri"
        },
        "body": {
          "en": "Mosaics form pictures from many small colored pieces called tesserae.",
          "tr": "Mozaikler tessera adı verilen çok sayıda küçük renkli parçadan oluşur."
        },
        "editorialStatus": "legacy-unverified"
      },
      "rewardId": "collectible_gaziantep_mosaic_piece"
    },
    {
      "id": "gaziantep-baklava",
      "order": 2,
      "assetId": "city_gaziantep_baklava_counter",
      "transform": {
        "position": [
          12,
          0,
          -6
        ],
        "rotation": [
          0,
          -0.25,
          0
        ],
        "scale": [
          1,
          1,
          1
        ]
      },
      "triggerRadius": 3,
      "camera": {
        "position": [
          10,
          2,
          0
        ],
        "target": [
          12,
          1,
          -6
        ],
        "durationMs": 750
      },
      "interaction": {
        "type": "sequence-select",
        "config": {
          "instruction": {
            "en": "Choose the three key parts of this baklava.",
            "tr": "Bu baklavanın üç temel bölümünü seç."
          },
          "requiredIds": [
            "thin-dough",
            "pistachio",
            "syrup"
          ],
          "distractorIds": [
            "tomato",
            "rice"
          ]
        }
      },
      "fact": {
        "title": {
          "en": "Gaziantep Baklava",
          "tr": "Gaziantep Baklavası"
        },
        "body": {
          "en": "Thin dough layers, pistachios and syrup create its crisp texture and rich taste.",
          "tr": "İnce hamur katları, fıstık ve şerbet çıtır dokuyu ve zengin tadı oluşturur."
        },
        "editorialStatus": "legacy-unverified"
      },
      "rewardId": "collectible_gaziantep_baklava"
    },
    {
      "id": "gaziantep-copper",
      "order": 3,
      "assetId": "city_gaziantep_coppersmith_workbench",
      "transform": {
        "position": [
          22,
          0,
          -4
        ],
        "rotation": [
          0,
          0.2,
          0
        ],
        "scale": [
          1,
          1,
          1
        ]
      },
      "triggerRadius": 4,
      "camera": {
        "position": [
          18,
          2,
          1
        ],
        "target": [
          22,
          1,
          -4
        ],
        "durationMs": 800
      },
      "interaction": {
        "type": "rhythm-repeat",
        "config": {
          "instruction": {
            "en": "Repeat the coppersmith's four-beat rhythm.",
            "tr": "Bakırcının dört vuruşluk ritmini tekrar et."
          },
          "pattern": [
            1,
            2,
            1,
            3
          ],
          "tempoBpm": 80,
          "maxRetriesBeforeSlowMode": 2
        }
      },
      "fact": {
        "title": {
          "en": "Coppersmiths' Bazaar",
          "tr": "Bakırcılar Çarşısı"
        },
        "body": {
          "en": "Craftspeople shape copper with repeated hammer strikes and practiced rhythm.",
          "tr": "Ustalar bakırı tekrarlanan çekiç darbeleri ve alışılmış bir ritimle biçimlendirir."
        },
        "editorialStatus": "legacy-unverified"
      },
      "rewardId": "collectible_gaziantep_copper_pot"
    }
  ],
  "quiz": [
    {
      "id": "gaziantep-quiz-01",
      "question": {
        "en": "Which ingredient gave the baklava its green color?",
        "tr": "Baklavaya yeşil rengini hangi malzeme verdi?"
      },
      "options": [
        {
          "id": "pistachio",
          "text": {
            "en": "Pistachio",
            "tr": "Fıstık"
          },
          "correct": true
        },
        {
          "id": "pea",
          "text": {
            "en": "Peas",
            "tr": "Bezelye"
          },
          "correct": false
        },
        {
          "id": "mint-gum",
          "text": {
            "en": "Mint gum",
            "tr": "Naneli sakız"
          },
          "correct": false
        }
      ]
    }
  ],
  "rewards": {
    "cityStarId": "star_gaziantep",
    "collectibleIds": [
      "collectible_gaziantep_mosaic_piece",
      "collectible_gaziantep_baklava",
      "collectible_gaziantep_copper_pot"
    ]
  }
}
